1、开启防火墙：
firewall-cmd --zone=public --add-port=3306/tcp --permanent
firewall-cmd --zone=public --add-port=3307/tcp --permanent
firewall-cmd --reload
firewall-cmd --permanent --query-port=3306/tcp
firewall-cmd --permanent --query-port=3307/tcp
 
2、下载：
wget http://dev.mysql.com/get/Downloads/MySQL-5.7/mysql-5.7.13-linux-glibc2.5-x86_64.tar

3、检查库文件是否存在，如有则删除：
[root@centos71 downloads]# rpm -qa | grep mysql
 mysql-libs-5.1.52-1.el6_0.1.x86_64

[root@centos71 downloads]# rpm -e mysql-libs-5.1.52-1.el6_0.1.x86_64 --nodeps
[root@centos71 downloads]# 
 
4、检查mysql组和用户是否存在，如无创建
[root@centos71 downloads]# cat /etc/group | grep mysql
 mysql:x:490:
[root@centos71 downloads]# cat /etc/passwd | grep mysql
 mysql:x:496:490::/home/mysql:/bin/bash
 以上为默认存在的情况，如无，执行添加命令：
[root@centos71 downloads]# groupadd mysql
[root@centos71 downloads]# useradd -r -g mysql mysql
 //useradd -r参数表示mysql用户是系统用户，不可用于登录系统。
 
5、解压TAR包，更改所属的组和用户
[root@centos71 downloads]# tar xf mysql-5.7.13-linux-glibc2.5-x86_64.tar -C /usr/local/
[root@centos72 downloads]# cd /usr/local/
[root@centos72 local]# tar zxf mysql-5.7.13-linux-glibc2.5-x86_64.tar.gz
[root@centos71 local]# ln -s mysql-5.7.13-linux-glibc2.5-x86_64 mysql

mkdir -p /opt/mysql/data3306
chmod 770 /opt/mysql/data3306
mkdir -p /opt/mysql/data3307
chmod 770 /opt/mysql/data3307
mkdir -p /opt/mysql/logbin
chmod 770 /opt/mysql/logbin
chown -R mysql.mysql /opt/mysql/data3306
chown -R mysql.mysql /opt/mysql/data3307
chown -R mysql.mysql /opt/mysql
chown -R mysql.mysql /opt/mysql/logbin

cd /usr/local/mysql
chown -R mysql .
chgrp -R mysql . 

vi /etc/profile
export MYSQL_HOME=/usr/local/mysql
export PATH=$MYSQL_HOME/bin:$PATH

6、安装和初始化数据库
mysqld --initialize --user=mysql --basedir=/usr/local/mysql --datadir=/opt/mysql/data3306
[Note] A temporary password is generated for root@localhost: !ra7TZq6a1-k
mysqld --initialize --user=mysql --basedir=/usr/local/mysql --datadir=/opt/mysql/data3307
[Note] A temporary password is generated for root@localhost: 5Z&mhk!vtVeI

7、修改配置：
vi /etc/my.cnf
[mysqld_multi]
mysqld=/usr/local/mysql/bin/mysqld_safe 
mysqladmin=/usr/local/mysql/bin/mysqladmin

[mysqld3306]
 basedir = /usr/local/mysql
 datadir = /opt/mysql/data3306
 log_bin = /opt/mysq/logbin/mysql-bin3306
 pid-file =/opt/mysql/data3306/mysqld3306.pid
 log-error=/opt/mysql/data3306/mysqld3306.err
 port = 3306
 character_set_server = utf8
 explicit_defaults_for_timestamp=true
 server_id = 3306
 socket=/tmp/mysql3306.sock
 slow_query_log = 1
 long_query_time = 1
 log_output = 'FILE'
 slow_query_log_file=/tmp/mysql_slow3306.log
 log_queries_not_using_indexes = 1
 lower_case_table_names=1
 binlog_cache_size = 1M
 binlog_format=mixed
 expire_logs_days=7

sql_mode=NO_ENGINE_SUBSTITUTION,STRICT_TRANS_TABLES

[mysqld3307]
 basedir = /usr/local/mysql
 datadir = /opt/mysql/data3307
 pid-file =/opt/mysql/data3307/mysqld3307.pid
 log-error=/opt/mysql/data3307/mysqld3307.err
 port = 3307
 character_set_server = utf8
 explicit_defaults_for_timestamp=true
 server_id = 3307
 socket=/tmp/mysql3307.sock
 slow_query_log = 1
 long_query_time = 1
 log_output = 'FILE'
 slow_query_log_file=/tmp/mysql_slow3307.log
 log_queries_not_using_indexes = 1
 lower_case_table_names=1
 binlog_cache_size = 1M
 binlog_format=mixed
 expire_logs_days=7

sql_mode=NO_ENGINE_SUBSTITUTION,STRICT_TRANS_TABLES

8、启动mysql实例：
mysqld_multi --defaults-file=/etc/my.cnf start 3306   #启动第一个实例，配置文件由my.cnf中的mysqld1设定  
mysqld_multi --defaults-file=/etc/my.cnf start 3306-3307 
mysqld_multi --defaults-file=/etc/my.cnf start 3306,3307 
mysqld_multi --defaults-file=/etc/my.cnf stop 3306  --user=root --password=root
mysqld_multi --defaults-file=/etc/my.cnf stop 3306,3307  --user=root --password=root
mysqld_multi --defaults-file=/etc/my.cnf stop 3306-3307  --user=root --password=root

9、第一次客户端连接：
mysql -u root  -S /tmp/mysql3306.sock -p
输入初始化密码：0R!rKl(aEGdl
mysql -u root  -S /tmp/mysql3307.sock -p
输入初始化密码：K5<!yq:d>1%n

以后连接：
mysql -u root  -S /tmp/mysql3306.sock -proot

10、修改密码：
mysql>SET PASSWORD = PASSWORD('root');
mysql> flush privileges;
 
11、配置允许远程登录：
mysql> use mysql
mysql> select Host, User from user;
+-----------+-----------+
| Host      | User      |
+-----------+-----------+
| localhost | mysql.sys |
| localhost | root      |
+-----------+-----------+
2 rows in set (0.00 sec)

mysql> grant all on *.* to 'root'@'%' identified by 'root';  # GRANT ALL PRIVILEGES ON *.* TO 'root'@'%' WITH GRANT OPTION;
mysql> flush privileges;
或者
mysql> update user set host ='%' where user = 'root';

mysql> select host, user from user;
+-------------+-----------+
| host        | user      |
+-------------+-----------+
| %           | root      |
| localhost   | mysql.sys |
+-------------+-----------+
2 rows in set (0.00 sec)

mysql> quit
Bye

12、主从复制：
m1 10.0.21.67:3306
s1 10.0.21.68:3307

m2 10.0.21.68:3306
s2 10.0.21.84:3307

m3 10.0.21.84:3306
s3 10.0.21.67:3307

a、在主服务器上创建复制账号：
mysql>CREATE USER 'repl'@'%' IDENTIFIED BY 'replPass';
mysql>GRANT REPLICATION SLAVE ON *.* TO 'repl'@'%';
mysql> flush privileges;

b、查看主服务器状态：
mysql>SHOW MASTER STATUS;
+-----------------------+----------+--------------+------------------+-------------------+
| File                  | Position | Binlog_Do_DB | Binlog_Ignore_DB | Executed_Gtid_Set |
+-----------------------+----------+--------------+------------------+-------------------+
| mysql-bin-3306.000001 |      762 |              |                  |                   |
+-----------------------+----------+--------------+------------------+-------------------+
1 row in set (0.00 sec)


c、从服务器上执行复制操作：
mysql>CHANGE MASTER TO
 MASTER_HOST='10.0.21.68',
 MASTER_PORT=3306,
 MASTER_USER='repl',
 MASTER_PASSWORD='replPass',
 MASTER_DELAY = 0,
 MASTER_LOG_FILE='mysql-bin-3306.000001',
 MASTER_LOG_POS=762;
 
d、启动从服务器复制功能：
mysql>start slave;

e、查看从库状态：
mysql> show slave satus\G;

 
 
